,restaurant,score,sentence,sentiment,polarity,positive,negative,neutral
417,Beffa's Bar & Restaurant,5,"Got there right at open. Very friendly and quick service. Ordered the frites appetizer, fish and chips and Pub Burger. All were exceptional!",0.3879761904761905,0.6371428571428571,0,0,1
418,Beffa's Bar & Restaurant,2,"I had dinner here last Saturday. Everything was good overall - the food & drinks were tasty and the food came out quick. My bill, including tip, was around $30 and I paid with a card. A couple days later I checked my bank account and I was charged over $42. I tried emailing the restaurant and calling (phones say not taking calls), but no response. If you eat here, be sure to take your receipt and pay with cash if possible so they don’t charge additional tip. I am hoping it was a honest mistake, but want others to at least keep in mind if dining here.",0.2037037037037037,0.48395061728395056,0,0,1
419,Beffa's Bar & Restaurant,1,"Was excited to try after seeing the St. Louis Burger Week special. Unfortunately, we were over looked by wait staff not once but twice  even though we were seated prior to the booths directly in front and behind us. We then asked for bacon on a burger and cheese to be added to a BLT and were told that this couldn't be done because of being short staffed.",-0.009693877551020405,0.5316326530612244,0,1,1
420,Beffa's Bar & Restaurant,5,Both the food and atmosphere was great. The waitress was friendly and personable. Definitely will be going back and checking out their Sunday Brunch!,0.29375,0.4375,0,0,1
421,Beffa's Bar & Restaurant,5,"I’ve enjoyed many items on the menu since Beffa’s reopening, and everything I have eaten so far is super delicious! Really loved the pub burger and the corned beef sandwich at lunch is top notch, it falls right apart. The homemade chips are also yum. They have a large drink selection and a modern feel with many awesome touches of the old Beffa’s. Highly recommend!!",0.4416666666666667,0.6193537414965986,0,0,1
422,Beffa's Bar & Restaurant,5,"Old school, great food.",0.45,0.475,0,0,1
423,Beffa's Bar & Restaurant,5,Cute spot. I live nearby and hadn't heard of it but went for burger week. Absolutely wonderful service and delicious food. Will be back.,0.5272727272727272,0.7,1,0,1
424,Beffa's Bar & Restaurant,5,Very friendly.. got the Smash Burger with their homemade fries..AMAZING!,0.609375,0.65,1,0,1
425,Beffa's Bar & Restaurant,5,"This is a true gem of a restaurant!
It’s a foodies dream!
I highly recommend this restaurant",0.3534375,0.595,0,0,1
426,Beffa's Bar & Restaurant,3,"Went for the #stlburgerweek with my friend. It was okay, might come back for brunch (it seems like they have better brunch options).",0.3333333333333333,0.3333333333333333,0,0,1
427,Beffa's Bar & Restaurant,3,The setting is good. The atmosphere is good.  My particular experience was going for 1/2 price burgers bit that day moves.  Okay so I was led on the Fish and Chips were super.   NOPE!  The fish wasn't.  The fish breading was rubberized the fish was muted in flavor.  The best part is their tartar sauce.  The fries are seasoned AND GOOD.,0.5541666666666666,0.48124999999999996,1,0,1
428,Beffa's Bar & Restaurant,5,Amazing food the cheese on the burger was great along with everything everything else the chip seemed to be homemade and was good right amount of seasoning and the people working are laid back and great atmosphere no wonder they've been around for 124 years.,0.530952380952381,0.5892857142857143,1,0,1
429,Beffa's Bar & Restaurant,5,"We walked to Beffa’s from union station for brunch on a Saturday. There was live music and were greeted and sat immediately. The service was amazing. Everyone working there was kind and paid attention to all the small details. We never had to ask for refills of coffee or water. They gave us a coloring book and crayons for our daughter. HUGE kudos to the small but efficient kitchen staff! We did have a little wait on the food, but as anyone could see, they were hustling! There were a few large tables ahead of us, but the wait was fine since the atmosphere was cozy. The food is very much worth every minute of the wait. Absolutely delicious and very reasonably priced. We had the stuffed French toast that was sweet, tart and creamy. The chicken biscuit with pimento cheese that was creamy with juicy but crispy chicken and a perfectly flaky biscuit. The FRIES so so so good (all fries should be seasoned like this). This place is a gem and I am so glad we randomly ended up here on our St. Louis trip! I read up on the history of the place after we went there and I am so glad they decided to reopen! GO BEFFA’s! 💜",0.18694545905483406,0.627440476190476,0,0,1
430,Beffa's Bar & Restaurant,5,"The Brunch I've always wanted. Great Friendly fast service, Great Prices, DELICIOUS FOOD OMG 🥲. The BEST CHICKEN & WAFFLES IN ST LOUIS! The bartender was so kind and kept the endless mimosas coming (strong everytime). And not to mention live music as you enjoy your food. Best Brunch Vibes Ever!",0.45151515151515154,0.6564102564102565,0,0,1
431,Beffa's Bar & Restaurant,5,"We liked dinner so much we came back for brunch the next day!! The Grilled Cheese and the Chicken & Waffles are absolutely amazing. Great portion sizes, super friendly staff and owners, and the prices are good too",0.3008333333333334,0.5366666666666667,0,0,1
432,Beffa's Bar & Restaurant,5,Great restaurant with great food. We came here for a Sunday brunch that was really good.,0.7666666666666666,0.7000000000000001,1,0,1
433,Beffa's Bar & Restaurant,5,"The BEST bar food 🙌 The staff was friendly and attentive. The food was declious!! Highly recommend the grilled cheese, Pub Burger, fries and the homemade chips!!! The portion sizes were large and you definitely get your money’s worth! I highly recommend this restaurant and will be back!",0.3401984126984127,0.4231746031746032,0,0,1
434,Beffa's Bar & Restaurant,5,"One word... WOW!   This place is amazing.   Everything myself or my family has eaten here has been excellent.  Great food, great atmosphere, great staff!

I went with the whole family for Saturday brunch and found something everyone enjoyed (I love the chicken and waffles, it's incredible).  Super friendly bartender who kindly went out of her way to surprise my kids with orange juice, too.  She's a mind reader.  Talk about going the extra mile.   What a fun place!

I've gotten carry out from Beffa's, too.  Did I mention that they have a spectacular Pub Burger?  Do yourself a favor and check this place out!   I'm hooked on Beffa's (and that Pub Burger)!",0.49681372549019603,0.703921568627451,0,0,1
435,Beffa's Bar & Restaurant,4,"If you are searching for a good burger in St. Louis, then look no further. I would venture to say it is the best burger I’ve had in St. Louis. Half price smash burgers on Wednesday. Large burger with all the toppings and a large side of fries. Very generous portions. Owner came up to us during dinner and personally checked on whether we were enjoying our meal. A very personal touch. Definitely recommend.

EDIT: THE FOOD IS STILL VERY GOOD HERE, BUT THE PRICES HAVE INCREASED SIGNIFICANTLY, WITH THE OFFERINGS BEING DECREASED. NO MORE HALF PRICE SMASH BURGER WEDNESDAYS. BURGERS ARE A DOLLAR MORE EXPENSIVE, WITH NO SIDE (NOW $4 EXTRA), AND YOU HAVE TO PAY EXTRA FOR LETTUCE AND TOMATO (WHEN THEY ARE IN SEASON!!!!). THIS EFFECTIVELY MAKES THE BURGER $5-6 MORE THAN IT WAS BEFORE. I UNDERSTAND PRICE INCREASES, BUT I THINK THEY MISS THE MARK WITH THIS ONE.",0.19228354978354975,0.4652489177489178,0,0,1
436,Beffa's Bar & Restaurant,5,"Incredible food, incredible staff, incredible atmosphere. I had such a blast at their 2000s themed trivia night and outdoor brunch. Nothing like sharing an ice cold mimosa with friends and some live music! My faves from the menu were the grilled cheese, southern chicken biscuit, and the Pub burger. Planning on going back soon to try more of the menu!
Such a hidden gem and a historic revival of a 100+ year family tradition. I’m beyond impressed.",0.22348484848484848,0.5702380952380952,0,0,1
437,Beffa's Bar & Restaurant,5,"We had an amazing experience here! The most amazing food you will ever be fortunate enough to eat, bottomless mimosas and an amazing atmosphere that cannot be rivaled. We stumbled upon this place in search of food, and what we found was sooo much more. The staff is amazing! Everyone lends a helping hand. Even when they are busy they still make you feel like you are their only customer they are waiting on. I would highly recommend you come here!",0.4,0.6945454545454546,0,0,1
438,Beffa's Bar & Restaurant,5,"Beffa's has it all--fantastic food, great service and a fun, friendly environment! Everything I have ordered has been delicious, but my favorite is hands down the grilled cheese. Best grilled cheese in the world! Beffa's has an inviting atmosphere for any time of day, and I highly recommend attending any event they host (I had a blast at their outdoor brunch tailgate and 2000s trivia night). It's clear to anyone that comes in that the owners put a lot of heart into every detail of this restaurant, kept family history alive and truly care about the overall customer experience.  I can't wait until my next visit to St. Louis, so I can plan a fun night with friends at Beffa's!",0.3575534188034188,0.42786324786324786,0,0,1
439,Beffa's Bar & Restaurant,5,Omg first off we want to give Kuddos to our great Server Campbell”80”….for such great patience and service!!! He made our yummylicious experience at this place so tasty & fun! ….We’re visiting from Dallas Tx and we will definitely be back if were ever back in Missouri …. Thanks again “80”,0.328125,0.3416666666666667,0,0,1
440,Beffa's Bar & Restaurant,1,"I have another review of this place giving 5 stars and it pains me that their inconsistency has forced me to make this review. First, our waitress did not tell us of the special that day that would have saved us 7 dollars, then we ask for recommendations on food. She suggests the $18 pasta dish that says wild mushrooms and broccoli, so we ordered it. We received a bland plate of macaroni and cheese shells...I kid you not. When we asked where the mushrooms and broccoli were, the waitress said nothing and took off to the kitchen, only to return and say, it's in the sauce (they were not and cannot just disappear) The pork sandwich was good, but our burger was pitiful and burnt.  Really is a shame. I enjoyed this place the first go around.",0.18904761904761905,0.5171428571428571,0,0,1
441,Beffa's Bar & Restaurant,5,"One of the best brunches in STL! I had the chicken biscuit and it was fantastic. Succulent chicken breast fried to perfection on a massive warm and flaky biscuit. Beffa’s also has one of the best Reuben sandwiches in the game, would highly recommend. If you’re in the area, you’ve gotta stop by for a meal, you won’t regret it. Not only is the food great, but the owners and staff are amazing, as well. They go above and beyond to make sure their guests are happy and satisfied.",0.2975,0.7236805555555555,0,0,1
442,Beffa's Bar & Restaurant,5,"Enjoyed the Buger week burger, the wings and Cesar Salad was very good too",0.705,0.74,1,0,1
443,Beffa's Bar & Restaurant,5,"My wife and I came across Beffa's on our drive back to Chicago from Austin, Texas. It was just what we needed after a long drive. Food was outstanding, service was excellent. The mixologist, I don't recall his name, was engaging and helped us expand our cocktail menu introducing us to the sasserak! Highly recommend this restaurant for anyone who finds themselves in St. Louis, even if you're simply passing through.",0.30142857142857143,0.5531632653061224,0,0,1
444,Beffa's Bar & Restaurant,5,Came here for brunch with a few friends and everything was delicious! The French toast is to die for!,0.26666666666666666,0.3666666666666667,0,0,1
445,Beffa's Bar & Restaurant,5,"Had the best time ever at Beffas restaurant, brunch on the parking lot. Plenty of room to social distance. One man band , Steve Winters was terrific and the food I just can’t say enough about. We had a pub burger, chicken and waffles, and their famous grilled cheese which is the best I’ve ever had.  Bottomless mimosas were a plus.  We will definitely be back.",0.2416666666666667,0.5145833333333333,0,0,1
446,Beffa's Bar & Restaurant,5,"I love Beffa’s!!! It’s by far one of my favorite restaurants in the St. Louis area. A very friendly, positive, and upbeat atmosphere. The restaurant is extremely welcoming and kid-friendly. We go just about every Saturday for brunch. They definitely have the best brunch around! Some menu favorites of mine are the Breakfast Wrap, the French Dip, the Crab Cakes, and the Truffle Fries!! Beffa’s also has a great Bloody Mary! We are always blown away by the quality of both the service, and the food! AMAZING!!! Keep it up Beffa’s!",0.33052793560606064,0.6787878787878787,0,0,1
447,Beffa's Bar & Restaurant,2,"1st time Sat 04/09 went for bunch the food was cold and the chicken and waffles were not good very hard and the chicken was dry, The French Toast was soggy but the drinks were good and the service",-0.23697916666666666,0.6755208333333333,0,1,1
448,Beffa's Bar & Restaurant,5,The food here is absolutely amazing! I’ve been multiple times and have never been disappointed. The Saturday brunch is unreal. The southern chicken sandwich. The bread pudding. The chicken and waffles! And the pub burger! You can’t go wrong with Beffa’s. The staff is also amazing and so kind! I can’t say enough good words about this place! Tell all your friends!! I have!,0.02840909090909095,0.6681818181818183,0,0,1
449,Beffa's Bar & Restaurant,5,"Our extended family eats there often and has had most items on the menu. Have enjoyed them all and will continue to make it our place to be.   We have really loved the Reuben, Pub Burger, Brussel Sprouts and of course the Fries!!  The staff has been very gracious and working really to make it a safe place to be.",0.4833333333333334,0.5,0,0,1
450,Beffa's Bar & Restaurant,5,"AMAZING! Came in on a quiet night. Were greeted before we even got to the door, got to learn a little bit about the history of this family owned place, and the food was completely mouth watering. 10/5 stars!",0.17187500000000003,0.5333333333333333,0,0,1
451,Pieces Board Game Bar And Restaurant,5,"The food was tasty and so were the drinks. I loved the game library. They had a good selection of games to choose from. Staff was friendly and helpful with figuring out game directions.

The waiters we always very attentive when the colored sticks are put in the air. It's a great way to to be to focus on the game, when you need something just put one, two, or all three colored sticks in the air to indicate what you need.

The waiter that took our order made great suggestions and gave a great review/description on the beyond sausage. It was very tasty.",0.33590909090909093,0.6045454545454546,0,0,1
452,Pieces Board Game Bar And Restaurant,5,"What a fun experience! A few tips for your first visit:
1. Get on the wait list ASAP! Even though the website said they weren't busy, they were packed and we waited over 30 minutes.
2. There's a parking lot right next door where you pay $1/hour. Not a bad fee, although we got lucky finding someone leaving that paid for the day.
3. They have food and drinks available,  but close down the kitchen from 2-3. We opted for the 2 for $5 cookie deal and they were the best cookies we'd EVER had!
4. There's so many board games to choose from, check out the list on their website ahead of time and do some research.
5. They have a great system of getting help with drinks, ordering food or games right at the table. Ask anyone, they are very helpful!
6. You pay $5/person to play the games, but children under 12 are free. They do discounts based on food or drink purchases though, so that helps.
7. Check their website for deal days when game fees are waived. Think fun girls night or date night with friends.
8. For a family of four we spent $30 with tip for 2.5 hours of games and 4 large cookies. We are already planning our next trip!",0.24052343159486014,0.3796296296296296,0,0,1
453,Pieces Board Game Bar And Restaurant,5,"Had a private room for the family, and the $45 fee was worth the privacy and noise reduction. Mimosas could be a little stronger (no one needs that much OJ) but they said they’d had problems with guests getting a little rowdy so I could understand. Breakfast slinger was huge, with plenty of sausage, egg, gravy, and hash browns in just the right proportions. Games were well kept and clean, with our server providing a brief tutorial on ones we didn’t know.",0.13082010582010584,0.46044973544973544,0,0,1
454,Pieces Board Game Bar And Restaurant,5,"What an amazing find.  Found out about Pieces last minute before taking our trip, and it will become a staple for our trips to St. Louis.  Went during happy hour, sat right down, and had a blast.  Kids loved it as well.  Food was great.",0.4328798185941043,0.6201814058956916,0,0,1
455,Pieces Board Game Bar And Restaurant,4,"Off to a shaky start, but I was generally so pleased with my visit to Pieces.

I was exploring Soulard on foot, and went in looking for a restroom before I ate. I have to say that the restroom was messy, cleaning supplies everywhere, a strong odor, water on the floors and around the toilets, and the stickiest floors imaginable. At that point I did almost turn around and leave.

I went inside the restaurant itself. There was no one at the door and no indication of whether I should seat myself. I had a seat at an empty table...and sat there for some time. No one came with water or a menu or anything, though servers were coming and going. Finally I noticed this little...canister in the middle of the table with three different colored flags, one to signal you wanted food, so I put that up.

This brought a server right to my table, and they said, ""Are you joining the party back there?"" and gestured to a full table. I said, ""...No?"" They said, ""Have you been here before?"" No. ""Was there someone at the door to tell you how things worked?"" Again I said no. ""Okay, what can I get for you?"" I was like, ""...A menu?"" Then another server brought me water before that person returned with a menu and water. I was like, ""Okay, is this the first puzzle?"" 😅

Anyway. I ordered an Edith Grey tea and the Midwest Poke Bowl. I appreciate the numerous veggie options. I asked the server about one-person games and several were suggested and explained well. I picked one out to try, then noticed my phone was dying and spent some time finding the power bank and cords in my bag.

The poke bowl came out before I'd gotten through the instructions, which was fine. It was delicious, even with tofu in place of fish. Lime was really unexpected and very tasty. At about this time I started noticing some coordination issues, and my activity tracker buzzed to let me know my heart rate was high. I've had some issues with vertigo that have been exacerbated this week, so I took meclizine I'd brought with me, but it was only getting worse. I ordered an Uber and my phone DIED right as I confirmed it! The staff were wonderful in helping my dizzy, frustrated self find a place to charge my phone and trying to help me stay calm. I was upset to have to leave so suddenly, but what I was able to eat of the poke bowl was delicious, and I hope to return another time.",0.17115440115440114,0.5576695526695526,0,0,1
456,Pieces Board Game Bar And Restaurant,5,Great for families!  Excellent Menu/ Service and entertainment.  So many different options for games.  We played a couple of different games with the kids.  They made some suggestions to help get us started.,0.5,0.6900000000000001,0,0,1
457,Pieces Board Game Bar And Restaurant,5,"An amazing place with many, many, many games to pick from. The staff is very knowledgeable and helpful. They offer space for private parties.
If you like board games make sure to bring your friends along to learn something new :)",0.38181818181818183,0.6020482603815936,0,0,1
458,Pieces Board Game Bar And Restaurant,5,"Love this place!! The concept is so cool and it was so enjoyable getting to play board games with friends and drinks. The prices were a bit high and some of the games were a little dirty, but overall I love the idea and the atmosphere. The staff was careful to disinfect each game after use which made me feel better. Drinks were good and we loved the game-themed menu. Spinach artichoke dip was the perfect snack to have during our visit. We were visiting from out of town but I would totally hang out here often!",0.26025000000000004,0.6226666666666667,0,0,1
459,Pieces Board Game Bar And Restaurant,5,Nice food and a great place to hang out.  Many people just along boardgames and having a nice time.  Not sure If I would bring my kids here but that's because I don't want to bother everyone else with my kids.  Prices are reasonable,0.4083333333333334,0.7898148148148149,0,0,1
460,Pieces Board Game Bar And Restaurant,4,"Friendly staff, good food.. the games were cool ! the drinks weren’t strong enough for the price .. tasted like all juice !",0.38916666666666666,0.5966666666666667,0,0,1
461,Pieces Board Game Bar And Restaurant,5,"I loved this place so much! Service was so nice and has a flag system for when you want to order food, drinks, or need help with a game. The food and drinks were the best we had in St Louis. Cannot recommend this place highly enough! Our kids loved it and enjoyed their food and they are PICKY. The ""tipsy protagonist"" drink is divine 🥰",0.41874999999999996,0.5875,0,0,1
462,Pieces Board Game Bar And Restaurant,5,"Relaxing spot to hang out and play some of the many, many games available. The food is quite good and there is even a full bar menu!",0.5075,0.51,1,0,1
463,Pieces Board Game Bar And Restaurant,5,Great place! Ton of games. We chose a game that none of the workers played before but they still helped us walk through it. I came for my birthday and we loved the food and environment. Definitely worth going again.,0.39999999999999997,0.5125,0,0,1
464,Pieces Board Game Bar And Restaurant,5,"Still in shock by the awesomeness of this establishment. Honestly, might be the best restaurant I’ve ever been to. But it’s more than a restaurant. The food menu alone was amazing with light healthy options and some more pub like stuff. Then you add the whole experience of board games, super creative drink menu, and DONUTS. Incredible helpful staff who care about the customer experience. This is 100% a 5 star.",0.5484848484848485,0.6606060606060606,1,0,1
465,Pieces Board Game Bar And Restaurant,5,"Always a great place. Whether taking children of a responsible and respectful age, or getting friends together for a nite out. You can sit back play some board games, eat, and drink to your hearts content.

Food is great, accommodating to all dietary requirements, and priced well. Staff are very helpful and always prompt.

I highly recommend this restaurant.",0.38,0.5128571428571428,0,0,1
466,Pieces Board Game Bar And Restaurant,5,Loved this restaurant. Very friendly staff. Good food. Yummy drinks. The overall game theme is nicely executed & love the idea of a board game restaurant! I was in heaven. Every table looked like they were having a blast. Great for a family outing or catching up with friends. Would be awesome for a first date! Highly recommended.,0.3815384615384616,0.6133333333333334,0,0,1
467,Pieces Board Game Bar And Restaurant,5,"If you haven't ever been here... GO!!!

This place is amazing, absolutely one of a kind. Had a great anniversary with the wife, spent hours eating, drinking, and learning all sorts of board games. The staff are crazy nice, and the food and drinks are very reasonably priced.",0.29500000000000004,0.77875,0,0,1
468,Pieces Board Game Bar And Restaurant,5,Last minute dinner decision ended up being one of the best meals and the most fun I've had in a long time. Both my kids loved it and my wife and I had a great time. Staff was good. Food was good. Lots of games to choose from. If you're going through town add this to the travel itinerary.,0.5166666666666667,0.46851851851851856,1,0,1
469,Pieces Board Game Bar And Restaurant,5,"The food here is fantastic, their impossible beef taco was my favorite, and I love normal beef! The beer selection is a little limited, but that's not a big issue. It does the job, and they have all the main ones you'd want. It's not about the beer. It's about the GAMES. And there are SO many. The worst part about the games is that you'll lose time playing them, because there's so many you'll spend lots of time picking one! It's a great place, with a lot of value to provide over multiple visits. It's not a one and done type of place, because you'll always find a new game to play. Be it a date or hanging out with a group of friends, you'll find something here.",0.09312094155844158,0.5519209956709957,0,0,1
470,Pieces Board Game Bar And Restaurant,5,"What a great place with an extremely friendly and welcoming atmosphere. The owners even stopped by my table to play a game of Oh My Gourd! with my 4 year old who was quite antsy at the time. While they make delicious food and offer a great beer selection, growing gourds seems to be their only weakness as my 4 year old was able to win. They were gracious in defeat.",0.3975000000000001,0.5825,0,0,1
471,Pieces Board Game Bar And Restaurant,5,"Went for the first time last night for date night and it was amazing! Very chill vibe the food and drinks were great. So many games to play. Covid precautions?100%! hand sanitizer, masks, game sanitizing station and distance…would highly recommend definitely going back!",0.23850000000000002,0.429,0,0,1
